{
  "id": "CCPA-135-dns-link",
  "version": "1.0.0",
  "framework": "ccpa",
  "title": "Do Not Sell Link Required",
  "severity": "critical",
  "summary": "Businesses that sell personal information must provide a clear and conspicuous link titled 'Do Not Sell My Personal Information' or 'Do Not Share My Personal Information' on their homepage.",
  "rationale": "",
  "detection": {
    "type": "hybrid",
    "patterns": [
      "do\\s+not\\s+sell",
      "do\\s+not\\s+share",
      "opt[\\s-]?out.*sale"
    ],
    "keywords": [
      "do not sell my personal information",
      "do not share my personal information",
      "DNS link"
    ]
  },
  "remediation": {
    "guidance": "Add visible \"Do Not Sell My Personal Information\" link in website footer.",
    "examples": []
  },
  "source": {
    "source_type": "public_law",
    "policy_status": "allowed",
    "citation": "Cal. Civ. Code § 1798.135(a)",
    "source_url": "https://oag.ca.gov/privacy/ccpa",
    "retrieved_at": "2026-02-09",
    "attribution_required": false
  },
  "metadata": {
    "tags": ["disclosure", "consent"],
    "jurisdiction": ["US-CA"],
    "content_types": ["landing-page", "marketing"],
    "owner": "qcme-core"
  }
}
