{
  "id": "CCPA-105-delete",
  "version": "1.0.0",
  "framework": "ccpa",
  "title": "Right to Delete",
  "severity": "warning",
  "summary": "Consumers have the right to request deletion of personal information collected from them.",
  "rationale": "",
  "detection": {
    "type": "hybrid",
    "patterns": [
      "delete.*personal\\s+information",
      "right\\s+to\\s+delet"
    ],
    "keywords": [
      "right to delete",
      "request deletion",
      "delete my data",
      "delete my information"
    ]
  },
  "remediation": {
    "guidance": "Provide clear mechanism to request deletion and respond within 45 days.",
    "examples": []
  },
  "source": {
    "source_type": "public_law",
    "policy_status": "allowed",
    "citation": "Cal. Civ. Code § 1798.105(a)",
    "source_url": "https://oag.ca.gov/privacy/ccpa",
    "retrieved_at": "2026-02-09",
    "attribution_required": false
  },
  "metadata": {
    "tags": ["data-rights"],
    "jurisdiction": ["US-CA"],
    "content_types": ["landing-page", "marketing"],
    "owner": "qcme-core"
  }
}
