{
  "id": "FTC-255-2-actor",
  "version": "1.0.0",
  "framework": "ftc",
  "title": "Actor Portrayal Requires Disclosure",
  "severity": "warning",
  "summary": "If the person appearing in an advertisement is not an actual consumer, this must be clearly disclosed.",
  "rationale": "",
  "detection": {
    "type": "hybrid",
    "patterns": [
      "actor\\s+portrayal",
      "dramatization",
      "simulation"
    ],
    "keywords": [
      "actor portrayal",
      "dramatization",
      "paid actor"
    ]
  },
  "remediation": {
    "guidance": "Clearly disclose \"Actor portrayal\" or \"Dramatization\" when not using actual customers.",
    "examples": []
  },
  "source": {
    "source_type": "public_law",
    "policy_status": "allowed",
    "citation": "16 CFR 255.2(b)",
    "source_url": "https://www.ecfr.gov/current/title-16/chapter-I/subchapter-B/part-255#255.2",
    "retrieved_at": "2026-02-09",
    "attribution_required": false
  },
  "metadata": {
    "tags": [
      "disclosure"
    ],
    "jurisdiction": [
      "US"
    ],
    "content_types": [
      "landing-page",
      "marketing"
    ],
    "owner": "qcme-core"
  }
}
