{
  "id": "FTC-238-3-adequate-supply",
  "version": "1.0.0",
  "framework": "ftc",
  "title": "Must Have Adequate Supply",
  "severity": "warning",
  "summary": "Advertisers must have adequate supply of advertised products to meet reasonably anticipated demand.",
  "rationale": "",
  "detection": {
    "type": "ai-only"
  },
  "remediation": {
    "guidance": "Stock sufficient inventory for advertised offers. If limited, clearly disclose quantity available.",
    "examples": []
  },
  "source": {
    "source_type": "public_law",
    "policy_status": "allowed",
    "citation": "16 CFR 238.3",
    "source_url": "https://www.ecfr.gov/current/title-16/chapter-I/subchapter-B/part-238#238.3",
    "retrieved_at": "2026-02-09",
    "attribution_required": false
  },
  "metadata": {
    "tags": [
      "general",
      "structural"
    ],
    "jurisdiction": [
      "US"
    ],
    "content_types": [
      "landing-page",
      "marketing"
    ],
    "owner": "qcme-core"
  }
}
