{
  "id": "SEC-482-c-expense-ratio",
  "version": "1.0.0",
  "framework": "sec-482",
  "title": "Expense Ratio Disclosure",
  "severity": "critical",
  "summary": "Investment company advertisements must disclose the total annual fund operating expense ratio from the most recent prospectus.",
  "rationale": "",
  "detection": {
    "type": "hybrid",
    "patterns": ["expense\\s+ratio", "operating\\s+expenses?", "\\d+(\\.\\d+)?%\\s+expense"],
    "keywords": ["expense ratio", "operating expenses", "management fee"]
  },
  "remediation": {
    "guidance": "Include total annual fund operating expense ratio from the most recent prospectus.",
    "examples": []
  },
  "source": {
    "source_type": "public_law",
    "policy_status": "allowed",
    "citation": "17 CFR 230.482(c)",
    "source_url": "https://www.ecfr.gov/current/title-17/chapter-II/part-230/section-230.482",
    "retrieved_at": "2026-02-09",
    "attribution_required": false
  },
  "metadata": {
    "tags": ["disclosure", "fees"],
    "jurisdiction": ["US"],
    "content_types": ["landing-page", "marketing"],
    "owner": "qcme-core"
  }
}
