{
  "id": "FTC-255-6-liability",
  "version": "1.0.0",
  "framework": "ftc",
  "title": "Advertiser Liable for Endorser Claims",
  "severity": "warning",
  "summary": "Advertisers are liable for false or unsubstantiated statements made by endorsers, and for failing to disclose material connections.",
  "rationale": "",
  "detection": {
    "type": "ai-only"
  },
  "remediation": {
    "guidance": "Monitor endorser content. Provide clear guidelines to endorsers. Require compliance training.",
    "examples": []
  },
  "source": {
    "source_type": "public_law",
    "policy_status": "allowed",
    "citation": "16 CFR 255.6",
    "source_url": "https://www.ecfr.gov/current/title-16/chapter-I/subchapter-B/part-255#255.6",
    "retrieved_at": "2026-02-09",
    "attribution_required": false
  },
  "metadata": {
    "tags": [
      "disclosure",
      "claims",
      "structural"
    ],
    "jurisdiction": [
      "US"
    ],
    "content_types": [
      "landing-page",
      "marketing"
    ],
    "owner": "qcme-core"
  }
}
